{
  "schema_version": "1.0",
  "case_id": "MECH-004",
  "candidate_id": "mech-004-valid-001",
  "artifact_type": "structured_engineering_response",
  "artifacts": [],
  "payload": {
    "missing_part_numbers": [
      "P-103"
    ],
    "extra_part_numbers": [
      "P-104"
    ],
    "quantity_mismatch_part_numbers": [
      "P-102"
    ],
    "revision_mismatch_part_numbers": [
      "P-101"
    ],
    "reconciliation_disposition": "reject_for_correction",
    "verification": true
  },
  "provenance": {
    "producer_type": "human_authored_example"
  }
}
